{
  "schema_version": "1.0.0",
  "publication_id": "publication_fixture_price_target",
  "revision_id": "publication_revision_fixture_price_target_v1",
  "revision_number": 1,
  "supersedes_revision_id": null,
  "case_id": "case_fixture_price_target",
  "slug": "synthetic-price-target",
  "display_status": "PUBLISHED_ANOMALY",
  "content_hash": "3b7f62290fe12781bdf199781e5fcd1790b70a3e05a2a5ba70182296389aa601",
  "title": "동일 조건 합성 공공계약 중앙값의 5.0배로 나타난 장비 구매",
  "summary": "합성 데이터 비교에서 대상 단가는 비교 가능한 12건의 중앙값보다 5.0배였다. 추가 인증·서비스 비용은 완전히 확인되지 않았으며, 이 결과만으로 위법성 또는 부패 여부를 판단할 수 없다.",
  "sections": [
    {
      "section_id": "finding",
      "heading": "확인된 차이",
      "blocks": [
        {
          "type": "METRIC",
          "text": "대상 2,400,000원 / 중앙값 480,000원 / 5.0배",
          "data": {
            "target_krw": 2400000,
            "median_krw": 480000,
            "ratio": 5.0,
            "n": 12
          }
        }
      ]
    },
    {
      "section_id": "limitations",
      "heading": "한계",
      "blocks": [
        {
          "type": "LIMITATION",
          "text": "추가 특수 인증과 교육 비용의 독립 금액은 공개 fixture에서 확인되지 않았다.",
          "data": null
        }
      ]
    },
    {
      "section_id": "response",
      "heading": "기관 답변",
      "blocks": [
        {
          "type": "RESPONSE",
          "text": "기관은 현장 교육이 포함됐다고 답했으나 금액 분리는 제출하지 않았다.",
          "data": null
        }
      ]
    }
  ],
  "claims": [
    {
      "claim_id": "claim_fixture_price_fact",
      "claim_type": "FACT",
      "text_ko": "합성 계약의 공개 단가는 VAT 포함 2,400,000원이다.",
      "evidence_refs": [
        {
          "evidence_id": "evidence_fixture_target_contract",
          "relation": "SUPPORTS"
        }
      ]
    },
    {
      "claim_id": "claim_fixture_price_comparison",
      "claim_type": "INFERENCE",
      "text_ko": "같은 분류·단위·VAT·기본 사양을 충족한 합성 비교 계약 12건의 중앙값보다 5.0배다.",
      "evidence_refs": [
        {
          "evidence_id": "evidence_fixture_price_calculation",
          "relation": "SUPPORTS"
        }
      ]
    },
    {
      "claim_id": "claim_fixture_price_limitation",
      "claim_type": "LIMITATION",
      "text_ko": "공개자료만으로 추가 인증·서비스 비용을 완전히 배제하거나 위법성·부패 여부를 판단할 수 없다.",
      "evidence_refs": [
        {
          "evidence_id": "evidence_fixture_certification_unknown",
          "relation": "SUPPORTS"
        },
        {
          "evidence_id": "evidence_fixture_agency_response",
          "relation": "QUALIFIES"
        }
      ]
    }
  ],
  "evidence": [
    {
      "evidence_id": "evidence_fixture_target_contract",
      "case_id": "case_fixture_price_target",
      "kind": "OFFICIAL_RECORD",
      "stance": "SUPPORTS",
      "tier": "A",
      "verification_status": "VERIFIED",
      "summary": "합성 계약의 수량·단가·VAT·단품 조건을 확인했다.",
      "source": {
        "source_document_id": "srcdoc_fixture_price_target",
        "locator": {
          "type": "API_FIELD",
          "value": "$.items[0]"
        },
        "source_url": "https://fixtures.gurine.invalid/price_target",
        "retrieved_at": "2026-01-15T03:10:00Z",
        "content_sha256": "5faec37739266f08e98e0fc8c2296c3e512a7981ee113422146280f30a927071"
      },
      "public_excerpt": "합성 계약: 단가 2,400,000원, 10개, VAT 포함",
      "redaction_status": "PUBLIC_APPROVED",
      "license_status": "REVIEWED_PUBLIC",
      "created_by": {
        "actor_type": "SERVICE",
        "actor_id": "fixture_builder",
        "display_role": "synthetic fixture"
      },
      "created_at": "2026-01-20T00:00:00Z"
    },
    {
      "evidence_id": "evidence_fixture_price_calculation",
      "case_id": "case_fixture_price_target",
      "kind": "CALCULATION",
      "stance": "SUPPORTS",
      "tier": "B",
      "verification_status": "VERIFIED",
      "summary": "비교 가능한 12건의 중앙값 480,000원과 대상 단가의 비율 5.0을 재현했다.",
      "source": {
        "source_document_id": "srcdoc_fixture_price_target",
        "locator": {
          "type": "API_FIELD",
          "value": "$.calculation"
        },
        "source_url": "https://fixtures.gurine.invalid/price_target",
        "retrieved_at": "2026-01-15T03:10:00Z",
        "content_sha256": "5faec37739266f08e98e0fc8c2296c3e512a7981ee113422146280f30a927071"
      },
      "public_excerpt": "중앙값 480,000원, 비율 5.0배",
      "redaction_status": "PUBLIC_APPROVED",
      "license_status": "REVIEWED_PUBLIC",
      "created_by": {
        "actor_type": "SERVICE",
        "actor_id": "fixture_builder",
        "display_role": "synthetic fixture"
      },
      "created_at": "2026-01-20T00:00:00Z"
    },
    {
      "evidence_id": "evidence_fixture_certification_unknown",
      "case_id": "case_fixture_price_target",
      "kind": "BACKGROUND",
      "stance": "CONTEXT",
      "tier": "C",
      "verification_status": "VERIFIED",
      "summary": "공개 fixture에는 추가 특수 인증 비용을 입증하는 독립 산출내역이 없다.",
      "source": {
        "source_document_id": "srcdoc_fixture_price_target",
        "locator": {
          "type": "API_FIELD",
          "value": "$.items[0].specification"
        },
        "source_url": "https://fixtures.gurine.invalid/price_target",
        "retrieved_at": "2026-01-15T03:10:00Z",
        "content_sha256": "5faec37739266f08e98e0fc8c2296c3e512a7981ee113422146280f30a927071"
      },
      "public_excerpt": "추가 인증 비용은 확인되지 않음",
      "redaction_status": "PUBLIC_APPROVED",
      "license_status": "REVIEWED_PUBLIC",
      "created_by": {
        "actor_type": "SERVICE",
        "actor_id": "fixture_builder",
        "display_role": "synthetic fixture"
      },
      "created_at": "2026-01-20T00:00:00Z"
    },
    {
      "evidence_id": "evidence_fixture_agency_response",
      "case_id": "case_fixture_price_target",
      "kind": "RESPONSE",
      "stance": "CONTRADICTS",
      "tier": "B",
      "verification_status": "VERIFIED",
      "summary": "기관은 현장 교육이 포함됐다고 답했으나 금액 분리는 제출하지 않았다.",
      "source": {
        "source_document_id": "srcdoc_fixture_price_target",
        "locator": {
          "type": "API_FIELD",
          "value": "$.syntheticResponse"
        },
        "source_url": "https://fixtures.gurine.invalid/price_target",
        "retrieved_at": "2026-01-15T03:10:00Z",
        "content_sha256": "5faec37739266f08e98e0fc8c2296c3e512a7981ee113422146280f30a927071"
      },
      "public_excerpt": "현장 교육 포함 주장, 금액 분리 미제출",
      "redaction_status": "PUBLIC_APPROVED",
      "license_status": "REVIEWED_PUBLIC",
      "created_by": {
        "actor_type": "SERVICE",
        "actor_id": "fixture_builder",
        "display_role": "synthetic fixture"
      },
      "created_at": "2026-01-20T00:00:00Z"
    }
  ],
  "subjects": [
    {
      "type": "AGENCY",
      "id": "agency_fixture_saebit",
      "display_name": "가상새빛시청",
      "public_url": "/agencies/agency_fixture_saebit"
    },
    {
      "type": "SUPPLIER",
      "id": "supplier_fixture_alpha",
      "display_name": "가상알파안전 주식회사",
      "public_url": "/suppliers/supplier_fixture_alpha"
    },
    {
      "type": "CONTRACT",
      "id": "contract_fixture_price_target",
      "display_name": "SYN-PRICE-TARGET",
      "public_url": "/contracts/contract_fixture_price_target"
    }
  ],
  "methodology": {
    "rule_key": "PRICE_OUTLIER",
    "rule_version": "1.0.0",
    "calculation": {
      "benchmark": "median",
      "target_unit_price_krw": 2400000,
      "median_krw": 480000,
      "ratio": 5.0,
      "cohort_size": 12
    },
    "limitations": [
      "합성 데이터로만 구성됐다.",
      "공개자료만으로 모든 부대비용을 확인할 수 없다."
    ],
    "reproducibility_bundle_url": "https://fixtures.gurine.invalid/repro/price-target-v1"
  },
  "responses": [
    {
      "party": "가상새빛시청",
      "status": "RECEIVED",
      "display_text": "현장 교육 포함 주장. 금액 분리 자료는 없음.",
      "received_at": "2026-01-25T02:00:00Z"
    },
    {
      "party": "가상알파안전 주식회사",
      "status": "NO_RESPONSE_BY_DEADLINE",
      "display_text": "기한 내 답변을 받지 못했습니다.",
      "received_at": null
    }
  ],
  "corrections": [],
  "source_freshness": [
    {
      "source_id": "pps_g2b_contracts",
      "source_published_at": "2025-06-15T00:00:00Z",
      "retrieved_at": "2026-01-15T03:10:00Z",
      "content_sha256": "5faec37739266f08e98e0fc8c2296c3e512a7981ee113422146280f30a927071"
    }
  ],
  "published_at": "2026-01-30T00:00:00Z",
  "updated_at": "2026-01-30T00:00:00Z",
  "review_summary": {
    "editor_approval_count": 1,
    "legal_reviewed": false,
    "policy_version": "editorial-1.0.0"
  }
}
